big mac, hamburguer, hamburguer, alface, queijo, molho especial, cebola, picles, pao com gergelim
cheddar mcmelt, pao com gergelim, carne, queijo cheddar, cebola caramelizada
mc chicken, pao com gergelim, frango empanado, alface, maionese
big tasty, pao com gergelim, hamburguer, alface, cebola, molho tasty
nugget, frango empanado, molho barbecue
batata frita, batata frita, sal
tortinha de maca, massa folhada, maca caramelizada, canela, acucar refinado
mcflurry de ovomaltine, sorvete de baunilha, calda de chocolate, ovomaltine
mcflurry de olho de gato, sorvete de baunilha, calda de chocolate, olho de gato
